{"id": "ntc-saved-001", "kind": "notice", "title": "Saved to reading notes", "body": "\"Foxes win because they change their minds.\"", "source": "dex", "created_at": "2026-09-27T21:12:00-05:00", "footer": "Superforecasting · ch 3", "data": {"saved": true, "book": {"title": "Superforecasting", "author": "Philip Tetlock", "chapter": "3"}}}
