{"id": "coach-call-001", "kind": "decision", "title": "QB this week", "body": "Keep Purdy over Maye. Maye has one TD and six picks through three games.", "source": "coach", "created_at": "2026-09-28T12:00:00-05:00", "data": {"default": "Start Purdy", "deadline": "Sun 12:00", "flip_if": "Flip only if Purdy is out before Sun 12:00"}, "actions": [{"id": "hear", "label": "Hear it", "style": "primary"}, {"id": "why", "label": "Why?", "style": "secondary"}, {"id": "later", "label": "Later", "style": "secondary"}]}
