{
  "id": "ed-almanac",
  "kind": "edition",
  "title": "Almanac",
  "source": "edition",
  "data": {
    "section": "almanac",
    "tiles": [
      {
        "value": "16°",
        "label": "At 08:00"
      },
      {
        "value": "05:45",
        "label": "Sunrise"
      },
      {
        "value": "17:50",
        "label": "Sunset"
      }
    ],
    "rows": [
      {
        "text": "Fri 13–22° · Sat 12–23° · Sun 11–20° · Mon 11–22°"
      }
    ],
    "moon": "full_moon"
  },
  "created_at": "2026-09-25T13:00:50+00:00",
  "fresh_until": "2026-09-26T13:00:50+00:00"
}
