{"id":"ed-almanac","kind":"edition","title":"Almanac","source":"edition","created_at":"2026-09-25T18:00:00-05:00","fresh_until":"2026-09-25T23:59:00-05:00","data":{"section":"almanac","edition_no":42,"tiles":[{"value":"19°","label":"Now"},{"value":"06:02","label":"Sunrise"},{"value":"18:11","label":"Sunset"}],"rows":[{"text":"Fri 21° · Sat 20° · Sun 18° · Mon 22°"}],"moon":"waxing_gibbous"}}
