{"id":"order-001","kind":"money","title":"Your usual, Corner Bistro","source":"delivery","created_at":"2026-09-25T18:00:00-05:00","footer":"Sample order. Nothing will be charged.","data":{"store":"Corner Bistro","items":[{"name":"Chicken and mushroom crepe","qty":1,"price":14},{"name":"Coconut lemonade","qty":1,"price":5}],"total":19,"currency":"USD","eta_min":35,"address_label":"Home","fixture":true},"actions":[{"id":"confirm","label":"Hold to order","style":"primary","hold_ms":2000},{"id":"reject","label":"Cancel","style":"secondary"}]}
