{
  "id": "ed-one_thing",
  "kind": "edition",
  "title": "Today's one thing",
  "source": "dex",
  "data": {
    "section": "one_thing"
  },
  "body": "The account notices come first; the garden-sensor build only needs its on-device install proof before the weekend.",
  "stale": true,
  "footer": "Digest desk missed deadline — last filed Thu 22:33",
  "created_at": "2026-09-25T03:33:19+00:00",
  "fresh_until": "2026-09-25T15:00:00+00:00"
}
