{"id":"ans-001","kind":"answer","title":"Metaphor vs simile","body":"A simile compares with 'like' or 'as' (brave as a lion). A metaphor states it outright (he is a lion). Same image; the metaphor commits harder.","source":"dex","created_at":"2026-09-25T18:00:00-05:00","footer":"Full version in Telegram"}
