{"id":"ed-sports","kind":"edition","title":"Sports desk","body":"Kittle is questionable. Bench him and start Kincaid.","source":"coach","created_at":"2026-09-25T18:00:00-05:00","fresh_until":"2026-09-25T23:59:00-05:00","data":{"section":"sports","rows":[{"text":"Bench Kittle, start Kincaid","stamp":"Sun 12:55"},{"text":"Claim a DST off waivers","stamp":"Wed"}]}}
