{"id":"job-001","kind":"job","title":"PR #42 reviewed","body":"1 blocking issue: the token is logged on auth failure. 2 nits.","source":"github","created_at":"2026-09-25T18:00:00-05:00","footer":"Full review in your notes","data":{"status":"done","link":"https://notes.example/review-42"},"actions":[{"id":"send_claude","label":"Send to Claude","style":"primary"},{"id":"later","label":"Later","style":"secondary"}]}
