{"id":"dec-001","kind":"decision","title":"Pause the side project?","body":"Eight weeks without a commit. Pull it off the board until the Zone Read test ends.","source":"dex","created_at":"2026-09-25T18:00:00-05:00","data":{"default":"Yes, pause","deadline":"Sunday"},"actions":[{"id":"approve","label":"Pause it","style":"primary"},{"id":"reject","label":"Keep it","style":"secondary"},{"id":"snooze","label":"Later","style":"secondary"}]}
